<?xml version="1.0" encoding="UTF-8"?>

<openbox_menu xmlns="http://openbox.org/"
        xmlns:xsi="http://www.w3.org/2001/XMLSchema-instance"
        xsi:schemaLocation="http://openbox.org/
                file:///usr/local/share/openbox/menu.xsd">

<menu id="ssh-menu" label="ssh (X11) to...">
<!--
  <item label="lychee">
    <action name="Execute"><execute>aterm -e ssh lychee</execute></action>
  </item>
  <item label="cvs">
    <action name="Execute"><execute>aterm -e ssh cvs</execute></action>
  </item>
  <item label="opi">
    <action name="Execute"><execute>aterm -e ssh opi</execute></action>
  </item>
  <item label="fire">
    <action name="Execute"><execute>aterm -e ssh fire</execute></action>
  </item>
-->
  <item label="namak">
    <action name="Execute"><execute>aterm -e ssh -Y namak</execute></action>
  </item>
</menu>

<menu id="apps-menu" label="Applications">
  <item label="Xterm">
    <action name="Execute"><execute>xterm -bg black -fg grey -fn fixed</execute></action>
  </item>
  <item label="Gaim">
    <action name="Execute"><execute>gaim</execute></action>
  </item>
  <item label="Quark">
    <action name="Execute"><execute>strange-quark</execute></action>
  </item>
</menu>

<menu id="root-menu" label="OB3@OBSD5">
  <menu id="ssh-menu" />
  <menu id="apps-menu" />
  <separator />
  <menu id="client-list-menu" />
  <separator />
  <item label="ObConf">
    <action name="Execute"><execute>obconf</execute></action>
  </item>
  <item label="Reconfigure">
    <action name="Reconfigure" />
  </item>
  <separator />
  <item label="Exit">
    <action name="Exit" />
  </item>
</menu>

</openbox_menu>

